{
  "$comment": "Generated by `gwylio schema` from the Pydantic models registered in backend/src/gwylio/infrastructure/config/schemas.py. Do not edit by hand.",
  "$defs": {
    "PlaceKind": {
      "description": "The kind of a named place.",
      "enum": [
        "nation",
        "region",
        "area",
        "river_basin",
        "settlement",
        "site"
      ],
      "title": "PlaceKind",
      "type": "string"
    }
  },
  "$id": "gating.schema.json",
  "$schema": "https://json-schema.org/draft/2020-12/schema",
  "additionalProperties": false,
  "description": "config/gating.json: own domains and relevance tokens for the gates.",
  "properties": {
    "notes": {
      "anyOf": [
        {
          "type": "string"
        },
        {
          "type": "null"
        }
      ],
      "default": null,
      "title": "Notes"
    },
    "own_domains": {
      "description": "The organisation's own domains: hits on them are dropped.",
      "items": {
        "pattern": "^[a-z0-9]([a-z0-9-]*[a-z0-9])?(\\.[a-z0-9]([a-z0-9-]*[a-z0-9])?)+$",
        "type": "string"
      },
      "minItems": 1,
      "title": "Own Domains",
      "type": "array"
    },
    "relevance_place_kinds": {
      "description": "Places of these kinds add their English and Welsh names as tokens.",
      "items": {
        "$ref": "#/$defs/PlaceKind"
      },
      "title": "Relevance Place Kinds",
      "type": "array"
    },
    "relevance_tokens": {
      "description": "Lower-case words or phrases that make an untrusted hit relevant.",
      "items": {
        "type": "string"
      },
      "minItems": 1,
      "title": "Relevance Tokens",
      "type": "array"
    }
  },
  "required": [
    "own_domains",
    "relevance_tokens"
  ],
  "title": "GatingFile",
  "type": "object"
}
